lom-bridge/legacy/midi_template.json

{
 "patcher": {
  "fileversion": 1,
  "appversion": {
   "major": 8,
   "minor": 1,
   "revision": 2,
   "architecture": "x64",
   "modernui": 1
  },
  "classnamespace": "box",
  "rect": [
   65.0,
   399.0,
   385.0,
   229.0
  ],
  "openrect": [
   0.0,
   0.0,
   0.0,
   169.0
  ],
  "bglocked": 0,
  "openinpresentation": 0,
  "default_fontsize": 10.0,
  "default_fontface": 0,
  "default_fontname": "Arial Bold",
  "gridonopen": 1,
  "gridsize": [
   8.0,
   8.0
  ],
  "gridsnaponopen": 1,
  "objectsnaponopen": 1,
  "statusbarvisible": 2,
  "toolbarvisible": 1,
  "lefttoolbarpinned": 0,
  "toptoolbarpinned": 0,
  "righttoolbarpinned": 0,
  "bottomtoolbarpinned": 0,
  "toolbars_unpinned_last_save": 0,
  "tallnewobj": 0,
  "boxanimatetime": 500,
  "enablehscroll": 1,
  "enablevscroll": 1,
  "devicewidth": 0.0,
  "description": "",
  "digest": "",
  "tags": "",
  "style": "",
  "subpatcher_template": "",
  "title": "Max MIDI Effect",
  "boxes": [
   {
    "box": {
     "id": "obj-5",
     "maxclass": "live.comment",
     "numinlets": 1,
     "numoutlets": 0,
     "patching_rect": [
      42.0,
      136.0,
      58.0,
      18.0
     ],
     "text": "MIDI to Live",
     "textjustification": 0
    }
   },
   {
    "box": {
     "id": "obj-4",
     "maxclass": "live.comment",
     "numinlets": 1,
     "numoutlets": 0,
     "patching_rect": [
      33.0,
      16.0,
      69.0,
      18.0
     ],
     "text": "MIDI from Live",
     "textjustification": 0
    }
   },
   {
    "box": {
     "id": "obj-3",
     "maxclass": "live.comment",
     "numinlets": 1,
     "numoutlets": 0,
     "patching_rect": [
      63.0,
      75.0,
      122.0,
      18.0
     ],
     "text": "Build your MIDI effect here",
     "textjustification": 0
    }
   },
   {
    "box": {
     "fontname": "Ableton Sans Medium Regular",
     "fontsize": 11.0,
     "hidden": 1,
     "id": "obj-9",
     "maxclass": "comment",
     "numinlets": 1,
     "numoutlets": 0,
     "patching_rect": [
      0.0,
      170.0,
      133.0,
      20.0
     ],
     "text": "Device vertical limit"
    }
   },
   {
    "box": {
     "fontname": "Arial Bold",
     "fontsize": 10.0,
     "id": "obj-2",
     "maxclass": "newobj",
     "numinlets": 1,
     "numoutlets": 0,
     "patching_rect": [
      48.0,
      114.0,
      47.0,
      20.0
     ],
     "text": "midiout"
    }
   },
   {
    "box": {
     "fontname": "Arial Bold",
     "fontsize": 10.0,
     "id": "obj-1",
     "maxclass": "newobj",
     "numinlets": 1,
     "numoutlets": 1,
     "outlettype": [
      "int"
     ],
     "patching_rect": [
      48.0,
      34.0,
      40.0,
      20.0
     ],
     "text": "midiin"
    }
   }
  ],
  "lines": [
   {
    "patchline": {
     "destination": [
      "obj-2",
      0
     ],
     "source": [
      "obj-1",
      0
     ]
    }
   }
  ],
  "dependency_cache": [],
  "latency": 0,
  "project": {
   "version": 1,
   "creationdate": 3590052786,
   "modificationdate": 3590052786,
   "viewrect": [
    0.0,
    0.0,
    300.0,
    500.0
   ],
   "autoorganize": 1,
   "hideprojectwindow": 1,
   "showdependencies": 1,
   "autolocalize": 0,
   "contents": {
    "patchers": {}
   },
   "layout": {},
   "searchpath": {},
   "detailsvisible": 0,
   "amxdtype": 1835887981,
   "readonly": 0,
   "devpathtype": 0,
   "devpath": ".",
   "sortmode": 0,
   "viewmode": 0
  },
  "autosave": 0
 }
}

corpus/constructeur/native-instruments-com-fileadmin-ni-media-downloads-manuals-maschine-maschine-3-software-m-10-8-working-with-plug-ins.md

# 8. Working with Plug-ins

Element
Description
Velocity
Adjusts the velocity response of the drum. Available values range from -100.0 %
to 100.0 % (default value). At zero (mid course), the drum is played at full
velocity, no matter how hard you hit the keys (or pads). From that mid position,
by turning the knob to the right you increase the positive velocity response and
make the drum more and more sensitive to the velocities at which you hit the
keys/pads. From the mid position, turning the knob to the left as the inverse
effect: the harder you hit the key/pad, the softer the resulting drum sound will
be.
Kick – Dusty
The Dusty kick is an electronic kick with an organic feel. It’s capable of broken, dusty sounds but
can also open up to a thundering warehouse boom.
The parameters described below are presented as they appear in the Control area
(Arrange view). The same parameters are available in the Plug-in panel within the
Plug-in Strip (Mix view). See The Plug-in Strip for more information on this.
Main page
Element
Description
MAIN Section
Engine
Selects the engine used in the Kick Plug-in. If you change this setting,
please refer to The kicks.
Tune
Adjusts the pitch of the drum played by the middle C, measured as a
percentage. Available values range from 0.0 to 100.0 % (default: 50.0 %).
For more details see Pitch range, tuning, and MIDI notes.
Decay
Adjusts the duration of the sound’s tail, measured as a percentage.
Available values range from 0.0 to 100.0 % (default: 50.0 %).
Impact
Adjusts the amount of attack and click, measured as a percentage.
Available values range from 0.0 % (soft attack) to 100.0 % (maximum
attack). The default value is 75.0 %.
CHARACTER
Section
Filter
Adjusts the timbre of the drum, measured as a percentage. Available
values range from 0.0 to 100.0 % (default: 40.0 %). Increase the value to
produce richer high frequencies.
Noise
Adjusts the amount of noise, measured as a percentage. Available values
range from 0.0 to 100.0 % (default: 10.0 %).
Advanced page
For this engine, the Advanced page does not contain any parameters.
Modulation page
As with all other engines and Drum Synths, the Modulation page contains one parameter: Velocity.
WORKING WITH PLUG-INS 178

Element
Description
AERO
Section
Grind
Adjusts the grittiness of the “aero” component of the sound, measured as a
percentage. Available values range from 0.0 to 100.0% (default: 45.0%). Low
values produce a boomy reverberation. High values result in a crushed, digital
“air” squashed into the drum sound. Note that this parameter will only have an
effect if Amount is set to a non-zero value (refer to below).
Amount
Controls the amount of air or grit in the kick sound, measured as a percentage.
Available values range from 0.0 to 100.0% (default: 20.0%).
Advanced page
For this engine the Advanced page does not contain any parameters.
Modulation page
Like with all other engines and Drum Synths, the Modulation page contains one parameter:
Velocity.
Element
Description
SCALE
Section
Velocity
Adjusts the velocity response of the drum. Available values range from -100.0%
to 100.0% (default value). At zero (mid course), the drum is played at full
velocity, no matter how hard you hit the keys (or pads). From that mid position,
by turning the knob to the right you increase the positive velocity response and
make the drum more sensitive to the velocity at which you hit the keys/pads.
From the mid position, turning the knob to the left as the inverse effect: the
harder you hit the key/pad, the softer the resulting drum sound will be.
Kick – Rasper
The Rasper kick is an acoustic bass drum emulation providing a unique and organic sound that
can be easily adapted into Drum’n’Bass or Dubstep productions. Its two crispness modes allow for
a wide range of bass drums.
The parameters described below are presented as they appear in the Control area
(Arrange view). The same parameters are available in the Plug-in panel within the
Plug-in Strip (Mix view). See The Plug-in Strip for more information on this.
Main page
Element
Description
MAIN Section
Engine
Selects the engine used in the Kick Plug-in. If you change this setting,
please refer to The kicks.
WORKING WITH PLUG-INS 180

Element
Description
Tune
Adjusts the pitch of the drum played by the middle C, measured in MIDI
note numbers and cents. Available values range from 38.00 to 62.00. The
default value is 50.00. For more details see Pitch range, tuning, and MIDI
notes.
Decay
Adjusts the duration of the sound’s tail, measured as a percentage.
Available values range from 0.0 to 100.0 % (default: 50.0 %).
Punch
Simultaneously adjusts the amount of the pitch envelope and the amount
of noise of the attack. Available values range from 0.0 to 100.0 % (default).
Impact
Adjusts how hard the drum is hit. Available values range from 0.0 %
(softest) to 100.0 % (hardest). The default value is 75.0 %.
CRISPNESS
Section
Mode
Selects from two different crispness modes: Select A (default) for a
tambourine-like sound, and select B for a snare-like sound.
Decay
Adjusts the duration of the crispness effect, measured as a percentage.
Available values range from 0.0 to 100.0 % (default: 34.0 %).
Amount
Adjusts the amount of crispness, measured as a percentage. Available
values range from 0.0 to 100.0 % (default: 50.0 %).
Advanced page
For this engine the Advanced page does not contain any parameters.
Modulation page
As with all other engines and Drum Synths, the Modulation page contains one parameter: Velocity.
Element
Description
SCALE
Section
Velocity
Adjusts the velocity response of the drum. Available values range from -100.0 %
to 100.0 % (default value). At zero (mid course), the drum is played at full
velocity, no matter how hard you hit the keys (or pads). From that mid position,
by turning the knob to the right you increase the positive velocity response and
make the drum more and more sensitive to the velocities at which you hit the
keys/pads. From the mid position, turning the knob to the left as the inverse
effect: the harder you hit the key/pad, the softer the resulting drum sound will
be.
Kick – Snappy
The Snappy kick is an acoustic bass drum emulation that provides control over the mic oscillation
before the hit via the Snap control. It’s capable of a mid-range bass drum sound that can be
tweaked via the extended punch parameters.
The parameters described below are presented as they appear in the Control area
(Arrange view). The same parameters are available in the Plug-in panel within the
Plug-in Strip (Mix view). See The Plug-in Strip for more information on this.
WORKING WITH PLUG-INS 181